{
  "question_id": "adversarial-ambiguous-underperformers",
  "answer": "Underperforming by which measure -- below expected oil (surveillance), watering out (water cut), or declining faster than forecast -- and over what period? Please specify before I answer.",
  "key_values": {},
  "behavior": "clarification-requested"
}
