{
  "question_id": "adversarial-trap-untested-rate",
  "answer": "No reliable figure -- NO 15/9-F-1 has no recent well test. Its only test (2023-05-27) predates the production data and carries no metered rate, so there is no current tested oil rate to quote.",
  "key_values": {},
  "behavior": "refused-data-quality"
}
